question|answer
kirim surat aktif kuliah|Kepada Yth Mahasiswa Program Studi [Nama Program Studi] Universitas [Nama Universitas] Di Tempat Dengan hormat Berdasarkan surat edaran dari Direktorat Akademik dan Kemahasiswaan Universitas [Nama Universitas] No. [Nomor Surat] maka kami mengundang para mahasiswa Program Studi [Nama Program Studi] untuk mengikuti kegiatan Aktif Kuliah yang akan diselenggarakan pada [Tanggal] di [Lokasi].Kegiatan Aktif Kuliah ini merupakan salah satu bentuk kegiatan yang dapat membantu mahasiswa dalam meningkatkan kualitas pembelajaran dan meningkatkan keterampilan mahasiswa. Kegiatan ini juga akan menjadi sarana untuk meningkatkan kualitas lulusan Program Studi [Nama Program Studi] dan mempersiapkan mahasiswa untuk menghadapi dunia kerja.Kami mengharapkan para mahasiswa Program Studi [Nama Program Studi] untuk hadir dan mengikuti kegiatan Aktif Kuliah ini.Demikian surat ini kami sampaikan. Atas perhatian dan kerjasamanya kami ucapkan terima kasih.Hormat kami [Nama Pimpinan] [Jabatan]
minta surat aktif kuliah|Yth.Kepala Bagian Akademik Universitas XYZdiJakartaDengan hormat,Saya yang bertanda tangan di bawah ini:Nama : NIM : Program Studi : Mengajukan permohonan untuk mendapatkan surat aktif kuliah.Demikian surat permohonan ini saya sampaikan, atas perhatian dan kerjasamanya saya ucapkan terima kasih.Hormat saya,[Tanda tangan][Nama]"
minta surat keterangan kuliah|Yang bertanda tangan di bawah ini :Nama : Jabatan : Menerangkan bahwa :Nama : NIM : Telah mengikuti kuliah di [Nama Perguruan Tinggi] pada semester [Semester] tahun akademik [Tahun Akademik].Demikian surat keterangan ini dibuat untuk dapat dipergunakan sebagaimana mestinya.[Tanda Tangan][Nama]
minta surat keterangan aktif kuliah|Yang bertanda tangan di bawah ini,Kepala Bagian Akademik Fakultas Ilmu Komputer Universitas XYZ,Menerangkan bahwa :Nama : ________________NIM : ________________Adalah mahasiswa Fakultas Ilmu Komputer Universitas XYZ yang sedang aktif mengikuti perkuliahan pada semester ___________ tahun ajaran ___________.Demikian surat keterangan ini dibuat dengan sebenarnya dan dapat dipergunakan sebagaimana mestinya.Hormat kami,Kepala Bagian AkademikFakultas Ilmu KomputerUniversitas XYZ"
minta surat keterangan aktif kuliah|Yang bertanda tangan di bawah ini,Kepala Bagian Akademik Fakultas Ilmu Komputer Universitas XYZ,Menerangkan bahwa :Nama : ________________NIM : ________________Adalah mahasiswa Fakultas Ilmu Komputer Universitas XYZ yang sedang aktif mengikuti perkuliahan pada semester ___________ tahun ajaran ___________.Demikian surat keterangan ini dibuat dengan sebenarnya dan dapat dipergunakan sebagaimana mestinya.Hormat kami,Kepala Bagian AkademikFakultas Ilmu KomputerUniversitas XYZ"
Salam kembali buat iqbal|Hai Iqbal, selamat datang kembali! Semoga hari-harimu menyenangkan.
cara minta transkrip nilai|Yth. Kepala Bagian AkademikUniversitas XYZdi TempatDengan hormat,Mahasiswa Universitas XYZ, Nama saya [Nama], dengan NIM [NIM]. Saya ingin meminta transkrip nilai semester [semester] yang telah saya tempuh.Demikian surat permohonan ini saya sampaikan, atas perhatian dan kerjasamanya saya ucapkan terima kasih.Hormat saya [Nama]
sudah siupload|Sudah berhasil. Terima kasih telah mengupload file Anda.
sudah diupload|Sudah, file telah berhasil diupload.
sudah di upload fotonya|Terimakasih telah mengupload foto.